{
  "crawldad": "1",
  "name": "ljcmg.enforcement.download",
  "inputs": {
    "backend":         { "type": "backend",       "required": true },
    "attachmentStore": { "type": "storageTarget", "required": true }
  },
  "config": {
    "backend": "input.backend",
    "defaultTimeoutMs": 120000
  },
  "vars": { "attachments": [] },
  "steps": [
    { "goto": { "url": "https://aca-prod.accela.com/LJCMG/Cap/CapDetail.aspx?Module=Enforcement&capID=24ENF-DL001&agencyCode=LJCMG" } },
    { "waitForLoadState": { "state": "load" } },

    { "comment": "scrape the filename cell (the SCRAPED name, distinct from the download's HTTP-suggested name)" },
    { "locate": { "var": "fileLink", "selector": "#attachmentList td:first-child a" } },
    { "set": { "var": "filename", "value": "trim(coalesce(text('#attachmentList td:first-child'),''))" } },

    { "comment": "download hashes the bytes and streams to the store; idempotent by content identity (§9.3)" },
    { "download": { "trigger": [ { "click": { "selector": "fileLink" } } ],
                    "to": "input.attachmentStore", "timeoutMs": 180000, "var": "dl" } },
    { "if": { "cond": "dl.stored",
        "then": [ { "push": { "into": "attachments", "value":
          "{ attachmentId: dl.contentId, filename: filename, internalFilename: string(dl.contentId) + (contains(filename,'.') ? '.' + substringAfterLast(filename,'.') : ''), sha256: dl.sha256, sizeBytes: dl.sizeBytes, storedAs: dl.storedAs, stored: dl.stored }" } } ],
        "else": [ { "log": { "level": "warning", "message": "Handling attachment failed: ${filename}" } } ] } },

    { "comment": "second download of the SAME content short-circuits on exists() → stored:true, no re-upload" },
    { "download": { "trigger": [ { "click": { "selector": "fileLink" } } ],
                    "to": "input.attachmentStore", "var": "dl2" } },
    { "if": { "cond": "dl2.stored",
        "then": [ { "push": { "into": "attachments", "value":
          "{ attachmentId: dl2.contentId, filename: filename, internalFilename: string(dl2.contentId) + (contains(filename,'.') ? '.' + substringAfterLast(filename,'.') : ''), sha256: dl2.sha256, sizeBytes: dl2.sizeBytes, storedAs: dl2.storedAs, stored: dl2.stored }" } } ] } }
  ],
  "result": "{ attachments: attachments }"
}
